url,address,price,size,average,bedroom-number,bathroom-number,reception-number
54439697,"Plot 8, Cresswell, The Embankment, Scholeys Wharf, Off Leach Lane, Mexborough S64",199950,1008.416827,198.2811023,3,2,1
54439692,"Plot 9, Cresswell, The Embankment, Scholeys Wharf, Off Leach Lane, Mexborough S64",199950,1008.416827,198.2811023,3,2,1
50735467,"Beechwood, Station Street, Misterton, Doncaster DN10",425000,3478.581142,122.1762502,4,0,0
54436050,"Wilby Lane, Barnsley S70",80000,96,833.3333333,2,1,2
54435883,"Waterslack Road, Bircotes, Doncaster DN11",100000,841.9447233,118.7726429,3,1,1
54435857,"Abbey Lane, Woodseats, Sheffield S8",99950,722,138.434903,2,1,1
54434054,"Bright Meadow, Halfway, Sheffield S20",300000,1735,172.9106628,5,3,3
54433792,"Scholars Gate, Cudworth, Barnsley S72",150000,999.0645445,150.1404497,4,2,2
54432703,"Wordsworth Court, Sheffield, South Yorkshire S5",90000,614,146.5798046,2,0,0
54432618,"Watch House Lane, Bentley, Doncaster DN5",130000,944.1875,137.6845171,3,1,2
54432037,"Chester Court, Eckington, Sheffield S21",260000,895.5792641,290.314895,4,1,1
54431960,"Cliffe Road, Walkley, Sheffield S6",190000,1096,173.3576642,3,1,2
54430915,"Firsby Lane, Conisbrough, Doncaster DN12",425000,2909.430556,146.076695,6,0,0
54430888,"Moor Farm Rise, Mosborough, Sheffield S20",175000,852,205.399061,3,1,1
54429868,"Brooke Court, Auckley, Doncaster DN9",90000,505.5222579,178.0337039,2,2,1
54429484,"Oakworth Drive, Halfway, Sheffield S20",55000,256.9,214.091086,0,1,1
54429307,"Upper Hoyland Road, Hoyland, Barnsley S74",375000,1018.472222,368.1985545,4,1,2
54428865,"Ellison Street, Thorne, Doncaster DN8",100000,871,114.8105626,3,1,1
54428546,"Plot 10, Cresswell, The Embankment, Scholeys Wharf, Off Leach Lane, Mexborough S64",189950,1008.416827,188.3645681,3,2,1
54428165,"Plot 11, Brooklynne, The Embankment, Scholeys Wharf, Off Leach Lane, Mexborough S64",224950,1086.041827,207.1283025,4,2,1
54427922,"Plot 2, Brooklynne, The Embankment, Scholeys Wharf, Off Leach Lane, Mexborough S64",224950,1086.041827,207.1283025,4,2,1
54427680,"Broadwater Drive, Dunscroft, Doncaster. DN7",155000,670.0416667,231.3288975,3,1,2
54406904,"Thicket Drive, Maltby, Rotherham S66",80000,460.0902778,173.8789187,1,1,1
54427603,"Burns Road, Maltby, Rotherham S66",69950,671.6111111,104.1525354,3,1,2
54370866,"Hepworth Drive, Swallownest, Sheffield S26",60000,668.5069444,89.7522464,3,0,0
54293119,"Scholeys Wharf, Leach Lane, Mexborough S64",189950,155.00016,1225.482606,4,2,1
54427573,"Fitzwilliam Court, Fitzwilliam Street, Wath-Upon-Dearne, Rotherham S63",52000,682.8680556,76.14941068,2,1,1
54427381,"Gaunt Road, Bramley, Rotherham S66",215000,781.5555556,275.0924083,3,1,2
54426698,"Southgate, Barnsley S75",163500,990.5,165.0681474,3,1,3
54426642,"Pilgrim Rise, Austerfield, Doncaster DN10",160000,440.9213588,362.8765012,2,1,1
54426586,"Millstream Close, Sprotbrough, Doncaster DN5",335000,1090.120122,307.3055832,4,2,2
54426593,"Parkside Close, Sheffield S12",174995,847.6319444,206.451634,3,2,1
54426452,"Devonshire Road, Dore, Sheffield S17",395000,1487,265.6355077,3,1,1
54426416,"Ashburton Close, Adwick-Le-Street, Doncaster DN6",145000,743,195.1547779,3,1,1
54425840,"West Point, West Street, Sheffield, South Yorkshire S1",135000,436.0574293,309.5922485,2,2,1
54425269,"Rosedale Road, Aston, Sheffield S26",150000,612.2291042,245.0063203,4,1,1
54424848,"Valley Road, Mapplewell, Barnsley S75",110000,690.1,159.3971888,2,1,1
54423511,"Tannery Close, Woodhouse, Sheffield S13",75000,591.1944444,126.8618146,3,1,1
54422461,"Anne Mcnamara House, Lydgate Lane, Crookes, Sheffield S10",190000,635,299.2125984,2,0,0
54422433,"Towngate Road, Worrall, Sheffield S35",450000,2401,187.4219075,4,0,0
54422178,"Millmount Road, Sheffield S8",230000,907,253.5832415,3,1,2
54412181,"Back Lane, Campsall, Doncaster DN6",290000,923.5416667,314.0085721,3,1,1
54422101,"Kingswood, Middlewood, Sheffield, South Yorkshire S6",160000,891.1111111,179.5511222,2,0,0
54422052,"Pickering Road, Doncaster DN5",105000,98,1071.428571,3,1,2
54422046,"Welbeck Street, Barnsley S75",90000,581,154.9053356,2,1,1
54421998,"Rosslyn Crescent, Bentley, Doncaster DN5",100000,270,370.3703704,3,1,2
54420411,"Occupation Road, Harley, Rotherham, South Yorkshire S62",160000,938,170.575693,3,1,2
54420347,"Queens Drive, Bentley, Doncaster DN5",135000,1089.521425,123.9076139,3,1,2
54420296,"Shore Lane, Sheffield S10",275000,1058.9,259.7034659,3,2,2
54419859,"Sheepcote Walk, Barnsley S70",125000,818,152.8117359,3,2,1
54419724,"""Windermere"" at ""Windermere"" At Carter Knowle Road, Bannerdale, Sheffield S7",399995,1871.416667,213.7391459,4,2,2
54419725,"""Halton"" at ""Halton"" At Carter Knowle Road, Bannerdale, Sheffield S7",442995,2133,207.6863572,4,2,2
54419730,"""Maidstone"" at Carrs Lane, Cudworth, Barnsley S72",177995,695.4791667,255.9314621,3,2,2
54419728,"""Maidstone"" at ""Maidstone"" At Carrs Lane, Cudworth, Barnsley S72",176995,1390.958333,127.2468023,3,2,2
54419727,"""Alderney"" at Carter Knowle Road, Bannerdale, Sheffield S7",447995,1064.652778,420.7897724,4,2,3
54419723,"""Alderney"" at ""Alderney"" At Carter Knowle Road, Bannerdale, Sheffield S7",442995,2129.305556,208.0467028,4,2,3
54419731,"""Maidstone"" at ""Maidstone"" At Carrs Lane, Cudworth, Barnsley S72",179995,1390.958333,129.4035887,3,2,2
54419726,"""Halton"" at Carter Knowle Road, Bannerdale, Sheffield S7",444995,1066.5,417.2480075,4,2,2
54419729,"""Maidstone"" at Carrs Lane, Cudworth, Barnsley S72",174995,695.4791667,251.6178893,3,2,2
54418674,"Chelsea Rise, Sheffield S11",175000,702.6,249.0748648,2,1,1
54418464,"Pine Road, Cantley, Doncaster DN4",135000,828.4166667,162.9614727,3,1,2
54418251,"Tulip Tree Close, Beighton, Sheffield S20",175000,753.2,232.3420074,3,1,2
54417697,"Devonshire Road, Harworth, Doncaster DN11",125000,674.7847222,185.2442651,3,0,0
54417696,"Tatenhill Gardens, Doncaster DN4",200000,792.5625,252.3460295,3,0,0
54417698,"Bawtry Road, Bessacarr, Doncaster DN4",399995,1742.743056,229.5203523,4,0,0
54416628,"Woodstock Road, Barnsley S75",230000,1497.416667,153.597863,5,0,0
54416000,"Wellington Road, Edlington, Doncaster DN12",80000,829,96.50180941,3,1,1
54415712,"Lundwood Grove, Owlthorpe, Sheffield S20",270000,1484.145833,181.9228232,4,3,3
54415545,"Lightwood Road, Marsh Lane, Sheffield S21",420000,2308,181.9757366,4,1,3
54415172,"Raeburn Road, Sheffield S14",110000,920,119.5652174,3,1,2
54415171,"Chancet Wood Drive, Sheffield S8",295000,1767,166.9496321,4,3,2
54415173,"Newfield Green Road, Sheffield S2",160000,994,160.9657948,3,1,1
52790857,"Standall Close, Dronfield Woodhouse, Derbyshire S18",595000,2188,271.9378428,5,4,3
54415154,"Sandygate Park, Sheffield, South Yorkshire S10",450000,2122,212.0640905,4,2,3
53258145,"Swallow Crescent, Rawmarsh, Rotherham S62",170000,1016.909722,167.1731485,3,1,1
54412394,"Westgate, Tickhill, Doncaster DN11",525000,1944.243056,270.0279672,4,2,4
54412294,"Knab Rise, Sheffield S7",250000,932.5,268.0965147,3,1,2
54412183,"Kenbourne Road, Sheffield S7",450000,1774,253.6640361,4,1,3
54411902,"Askern Road, Toll Bar, Doncaster, South Yorkshire DN5",70000,1034,67.69825919,2,1,1
54411689,"Wentworth Court, Bawtry, Doncaster DN10",675000,2873.965278,234.8671382,6,4,3
54411666,"Stenton Road, Sheffield S8",360000,1585,227.1293375,4,1,2
54411619,"Kew Crescent, Sheffield S12",150000,1524,98.42519685,3,1,2
54411171,"Peakstone Close, Balby, Doncaster, South Yorkshire DN4",130000,657.693665,197.6604108,3,1,1
54410176,"Kingsley Crescent, Armthorpe, Doncaster DN3",159950,697.7361111,229.2413958,3,1,2
54409291,"Bocking Lane, Sheffield, South Yorkshire S8",235000,1127,208.5181899,3,0,0
54409255,"Keswick Close, Loxley, Sheffield, South Yorkshire S6",190000,710,267.6056338,3,1,2
54408648,"Arran Hill, Thrybergh, Rotherham S65",175000,729.1458333,240.0068573,3,1,2
54407872,"Grenville Road, Balby, Doncaster. DN4",130000,753.7916667,172.4614449,3,1,2
54407562,"St. Helens Avenue, Barnsley S71",150000,1213,123.6603462,3,1,1
54407393,"Carter Knowle Road, Sheffield S7",300000,1096.8,273.5229759,3,1,2
54406981,"Rectory Gardens, Doncaster DN1",290000,1383.858651,209.5589747,3,2,2
54406895,"Winchester House, Winchester Way, Doncaster, South Yorkshire DN5",47000,549,85.61020036,2,1,1
54406488,"Bramley Way, Misterton, South Yorkshire DN10",165500,1117.29282,148.1258959,3,2,1
54406186,"West End Road, West Melton, Rotherham S63",89950,907.612048,99.10622077,3,1,2
54405898,"Upperfield Close, Maltby, Rotherham S66",169995,764.2152778,222.4438649,3,1,2
54405735,"Redbrook Croft, Owlthorpe, Sheffield S20",260000,794.8541667,327.1040285,3,1,1
54404795,"Wellington Drive, Finningley, Doncaster DN9",370000,1361.375,271.7840419,4,0,0
54404794,"Stonegate Close, Blaxton, Doncaster DN9",170000,588.7708333,288.7371289,2,0,0
52933579,"""The Foxhill"" at Harborough Avenue, Sheffield S2",127995,592.4305556,216.0506388,2,1,2
54403262,"Dundas Road, Wheatley, Doncaster DN2",104950,649.386087,161.6141801,2,1,1
54403211,"First Avenue, Woodlands, Doncaster DN6",115000,840,136.9047619,3,1,1
51305029,"Brampton Beck, Brampton, Barnsley, South Yorkshire S73",90000,710,126.7605634,2,0,0
54402273,"Jackdaw Drive, Wath-Upon-Dearne, Rotherham S63",199950,944.8611111,211.6184036,3,2,1
54401770,"Warde Aldam Crescent, Wickersley, Rotherham, South Yorkshire S66",230000,1032,222.8682171,3,1,2
54401771,"Dale Avenue, Rotherham, South Yorkshire S65",175000,1051,166.5080875,3,0,0
54401685,"Lawn Avenue, Woodlands, Doncaster DN6",100000,644.9305556,155.0554539,3,1,1
54401450,"Westfield Road, Rotherham S62",260000,1639,158.633313,4,3,2
54401183,"Peakdale Crescent, Frecheville, Sheffield S12",140000,884,158.3710407,3,1,1
54397750,"Birch Avenue, Chapeltown, Sheffield, South Yorkshire S35",117000,958,122.1294363,3,1,1
54397751,"Carter Knowle Road, Sheffield S11",400000,1377.8,290.3178981,4,1,2
54396983,"The Avenue, Campsall, Doncaster, South Yorkshire DN6",120000,875,137.1428571,3,1,1
54396949,"Hawthorn Croft, Misterton, Doncaster DN10",235000,882.0625,266.4210303,3,2,1
54396828,"Fir Tree Drive, Wales, Sheffield S26",200000,780.7,256.180351,3,1,1
54396635,"Pasture Way, Tickhill, Doncaster DN11",263000,802.4583333,327.7428735,3,2,0
54396608,"Hunters Way, Dinnington, Sheffield S25",70000,417.2,167.7852349,1,1,1
54396455,"Belvedere Close, Askern, Doncaster DN6",115000,772.0763889,148.9489922,2,0,0
54396410,"High Greave, Barnsley S71",150000,839.7916667,178.6157281,3,2,1
54396398,"Pickering Road, Bentley, Doncaster DN5",105000,102,1029.411765,3,1,2
54396393,"Laycock Avenue, Gringley-On-The-Hill, Doncaster DN10",150000,699,214.5922747,3,1,1
54395960,"Southgate, Eckington, Sheffield S21",550000,3170,173.5015773,5,3,3
54395414,"Myrtle Crescent, Wickersley, Rotherham S66",155000,794.1,195.1895227,3,1,2
54395253,"Arksey Lane, Doncaster, South Yorkshire DN5",129950,1317.1,98.66373092,3,1,1
54394237,"Gleadless View, Sheffield S12",180000,995,180.9045226,3,2,1
54393925,"Alder Holt Close, Armthorpe, Doncaster DN3",145000,700.9375,206.8658047,3,1,0
52728606,"Tom Lane, Sheffield S10",750000,2050.7,365.7287755,4,3,2
54393791,"Cross Lane, Royston, Barnsley S71",100000,656.7638889,152.261721,3,1,1
54393737,"Willow Road, Campsall, Doncaster DN6",120000,990,121.2121212,3,1,2
49383017,"Nile Street, Sheffield S10",330000,1516.8,217.5632911,5,2,2
54393606,"Greenhill Avenue, Barnsley S71",175000,828.0902778,211.3296155,3,1,2
54393595,"Ledsham Court, Elsecar, Barnsley S74",130000,600,216.6666667,2,1,1
54393102,"Bosville Street, Rotherham S65",100000,334.1265255,299.2878218,1,1,1
54392877,"City Road, Sheffield, South Yorkshire S2",140000,1754.5157,79.79409931,3,1,2
54392823,"Owston Road, Carcroft, Doncaster. DN6",95000,819.3888889,115.9400637,3,1,2
54392465,"High Street, Killamarsh, Sheffield, Derbyshire S21",120000,712,168.5393258,2,1,1
54392451,"Hangingwater Road, Sheffield, South Yorkshire S11",260000,1140,228.0701754,3,0,0
54392456,"Sough Hall Road, Thorpe Hesley, Rotherham, South Yorkshire S61",295000,1391,212.077642,3,2,2
54392004,"Barkers Croft, Rotherham, South Yorkshire S61",80000,915,87.43169399,3,1,2
54391653,"Cemetery Road, Grimethorpe, Barnsley S72",87000,594.1388889,146.4304082,2,1,2
54391192,"Bracon, Belton, Doncaster DN9",320000,1468.389378,217.9258478,4,1,2
54391070,"Tatenhill Gardens, Bessacarr, Doncaster DN4",185000,699.1723537,264.5985629,3,1,2
54390820,"Darton Lane, Mapplewell, Barnsley S75",170000,641.1944444,265.1301824,3,1,2
54390555,"St. Helens Place, Barnsley S71",180000,947,190.0739176,3,2,2
54389884,"""Windsor"" at School Street, Thurnscoe, Rotherham S63",169995,741.3888889,229.292619,3,2,2
54389696,"Roebuck Ridge, Jump, Barnsley S74",250000,1440.729167,173.5232449,4,0,0
54520926,"Shady Side, Shadyside, Hexthorpe, Doncaster DN4",90000,968,92.97520661,3,1,0
54387992,"Park Grange Mount, Sheffield S2",120000,609.5,196.8826907,2,1,1
54387956,"Manchester Road, Thurlstone, Sheffield S36",145000,840,172.6190476,3,2,1
54387293,"Staniforth Avenue, Eckington, Sheffield, Derbyshire S21",185000,886,208.8036117,3,1,1
54405948,"Roebuck Chase, Wath-Upon-Dearne, Rotherham S63",160000,636.4271287,251.403488,3,0,0
54387099,"Newman Road, Sheffield S9",115000,608.6388889,188.9461914,3,1,2
54385277,"Mosborough Hall Drive, Halfway, Sheffield S20",230000,1094.7,210.1032246,4,1,2
54385220,"Millmount Road, Sheffield S8",160000,874.8,182.8989483,2,1,2
54384327,"Crowgate, South Anston, Sheffield S25",450000,1356,331.8584071,3,2,2
54384171,"Kirton Lane, Thorne, Doncaster DN8",125000,565.6388889,220.9890488,2,0,0
54384114,"The Circuit, Woodlands, Doncaster DN6",120000,99,1212.121212,3,1,2
54383067,"St Margarets Avenue, Barnburgh, Doncaster DN5",165000,749.7779143,220.0651644,3,1,1
54383068,"Queens Avenue, Swinton, Mexborough S64",220000,840.3333333,261.8008727,3,1,1
54382573,"Carrs Lane, Cudworth, Barnsley S72",159950,518.712341,308.359735,3,3,1
54382059,"Farrington Court, Wickersley, Rotherham, South Yorkshire S66",550000,2498,220.1761409,4,0,0
54379724,"Chappell Road, Hoylandswaine, Sheffield S36",225000,857,262.5437573,3,1,2
54378913,"Boynton Crescent, Sheffield, South Yorkshire S5",70000,560,125,2,1,1
52927202,"Fairmount Gardens, Hackenthorpe, Sheffield S12",262500,828,317.0289855,3,1,1
54378757,"Stoneway Mews, Green Moor Wortley, - Viewing Essential S35",367500,1449,253.6231884,4,2,2
54377479,"Beechwood Lodge, Doncaster Road, Rotherham S65",90000,446.3764408,201.6235441,2,1,1
54377059,"Worry Goose Lane, Rotherham S60",200000,891,224.4668911,3,1,1
54375536,"Beechwood Road, Hillsborough, Sheffield S6",150000,904,165.9292035,3,0,0
54375284,"Measham Drive, Stainforth, Doncaster DN7",120000,461.9791667,259.7519729,2,0,0
54374868,"The Potteries, New Rossington, Doncaster DN11",239950,844.0694444,284.2775575,4,2,1
54369948,"The Pastures, Royston, Barnsley S71",245000,878.8402778,278.776481,4,3,1
54395332,"Warwick Road, Monk Bretton, Barnsley S71",175000,612.6805556,285.6300864,3,1,2
54374570,"Oaks Lane, Sheffield, South Yorkshire S5",225000,1171,192.1434671,3,0,0
54374528,"Arlott Way, Edlington, Doncaster, South Yorkshire DN12",165000,821.7430556,200.7926917,4,0,0
54374291,"Ellwood, Barnsley S71",150000,764,196.3350785,3,1,1
54374248,"Quarry Field Lane, Wickersley, Rotherham, South Yorkshire S66",140000,697,200.8608321,2,0,0
54374247,"Cheadle Street, Sheffield, South Yorkshire S6",160000,826,193.7046005,2,0,0
54374018,"Arthur Place, Bentley, Doncaster DN5",100000,883,113.2502831,3,1,2
54373953,"Hill Street, Elsecar, Barnsley S74",275000,357,770.3081232,4,1,1
54372318,"Greenwood Road, Kilnhurst, Mexborough S64",125000,565.0486111,221.2199049,3,1,1
54372051,"Elmfield Road, Doncaster, South Yorkshire DN1",90000,1517.7099,59.29987015,3,1,1
54372013,"Smithies Lane, Barnsley S71",110000,599.0412802,183.6267443,3,1,1
54372018,"Chequer Avenue, Hyde Park, Doncaster DN4",100000,829.4540046,120.561236,3,1,2
51790706,"Mansfield Road, Sheffield S12",100000,956,104.6025105,3,1,1
54371707,"Meynell Crescent, Sheffield, South Yorkshire S5",85000,710,119.7183099,3,1,1
54371043,"Barnsley Road, Moorends, Doncaster DN8",90000,619.0277778,145.3892753,3,1,1
54370478,"Rosemary Road, Beighton, Sheffield S20",140000,560.2916667,249.8698594,3,1,1
54370351,"Reapers Rise, Epworth, Doncaster DN9",190000,1613.229167,117.7761994,3,2,2
54370347,"Arncliffe Drive, Barnsley S70",90000,973.7,92.43093355,3,1,1
54369746,"Ravenfield Close, Owlthorpe, Sheffield S20",170000,576,295.1388889,2,1,1
54369052,"Metis, 1 Scotland Street, Sheffield, South Yorkshire S3",95000,489,194.2740286,1,1,1
54368480,"Hall Court, Thorne, Doncaster DN8",340000,1756.965833,193.5154308,5,2,1
54368475,"Greenfield Gardens, Flanderwell, Rotherham S66",145000,374.7291667,386.9461278,2,1,1
54368458,"Solly Street, Sheffield S1",110000,310.7569444,353.9743905,1,1,1
51642344,"Berry Drive, Kiveton Park, Sheffield S26",165000,784.1041667,210.4312246,3,2,1
54367715,"Akeferry Road, Westwoodside, Doncaster DN9",385000,1642.534722,234.3938273,3,2,2
54366647,"Upper Sheffield Road, Barnsley, South Yorkshire S70",130000,1087.1539,119.578286,3,0,0
54365348,"Water Slacks Road, Woodhouse, Sheffield S13",77500,538.2569444,143.9832794,3,1,1
54365315,"Station Road, Walkeringham, Doncaster DN10",410000,2078.50909,197.256775,2,1,1
54364216,"""Bamburgh"" at School Street, Thurnscoe, Rotherham S63",156995,950.2361111,165.2168321,3,2,1
54361025,"Handsworth Grange Road, Sheffield S13",125000,821.6,152.1421616,2,1,1
54360955,"Novara Close, Barnsley S70",160000,879.6597222,181.8885143,3,0,0
54360952,"May Terrace, Barnsley S70",130000,834.5763889,155.7676466,3,0,0
54359865,"Wortley Road, High Green, Sheffield, South Yorkshire S35",110000,497.3216538,221.184819,2,0,0
54359832,"Brooke Close, Deepcar, Sheffield, South Yorkshire S36",155000,543.2916667,285.2979523,2,0,0
44088452,"Little Common Lane, Sheffield, South Yorkshire S11",485000,1906,254.4596013,4,2,2
54359490,"Cross Hill Close, Ecclesfield, Sheffield, South Yorkshire S35",220000,1159,189.8188093,3,0,0
54359145,"Pilley Green, Pilley Barnsley S75",275000,1330,206.7669173,4,1,2
54359112,"Hawthorne Road, Auckley, Doncaster DN9",190000,902.1258187,210.6136373,3,2,1
54357164,"Washington Road, Sheffield S11",90000,953.8,94.35940449,3,1,1
54356456,"Winton Road, Intake, Doncaster DN2",110000,619.7569444,177.488935,3,0,0
54356407,"51, Smithy Wood Crescent, Woodseats S8",365000,5705,63.97896582,5,3,3
54356268,"Aldfield Way, Sheffield S5",120000,825,145.4545455,3,1,1
54355811,"Moorhouse Drive, Thurcroft, Rotherham S66",195000,713.0902778,273.4576618,3,1,1
54355795,"St Martins Avenue, Cusworth, Doncaster DN5",129950,527.9885619,246.122756,3,1,1
54355117,"Corwen Place, Woodhouse, Sheffield S13",100000,787.6,126.9680041,3,1,1
54354304,"27 Dore Road, Sheffield S17",300000,829,361.8817853,2,1,1
54353992,"Thompson Avenue, Edlington, Doncaster DN12",119500,478.9108994,249.5244943,3,1,1
54353239,"Ashleigh Gardens, Greasbrough, Rotherham S61",150000,692.6926074,216.5462695,3,1,2
54353217,"High Street, Dunsville, Doncaster DN7",130000,597.7229826,217.4920553,3,0,0
54353124,"Oakfern Grove, High Green, Sheffield S35",130000,559.5,232.3503128,2,1,1
54352570,"Mansfield Crescent, Doncaster, South Yorkshire DN3",115000,687.705571,167.2227256,3,1,1
54352529,"Abbeydale Road South, Sheffield S7",525000,1776.1,295.5914644,4,3,2
54352501,"Larwood Grove, Edlington, Doncaster DN12",118000,467.8541667,252.2153449,2,1,1
54351981,"The Chimes, 18 Vicar Lane, Sheffield, South Yorkshire S1",130000,626,207.6677316,1,1,1
54351912,"Whirlowdale Road, Sheffield S11",850000,2049.8,414.6746024,4,1,2
54351828,"Haigh Lane, Haigh, Barnsley S75",120000,665.900899,180.206995,3,1,1
54351496,"Churchfield Avenue, Cudworth, Barnsley, South Yorkshire S72",110000,635.0528778,173.2139226,3,1,1
54351197,"Upper Hoyland Road, Hoyland, Barnsley S74",260000,1151.208333,225.8496507,3,1,1
53213764,"Springfield Road, Sheffield S7",475000,1594.9,297.824315,4,2,3
54350472,"Naylor Road, Oughtibridge, Sheffield S35",160000,958,167.0146138,2,1,1
54350429,"Longfield Road, Sheffield S10",159950,538.9791667,296.7647173,2,1,1
54349928,"Warren Walk, Royston, Barnsley S71",379950,1992.182612,190.7204679,4,2,3
54347984,"Field Drive, Cudworth, Barnsley S72",180000,1402,128.3880171,4,1,2
54347855,"Park Road, Askern, Doncaster DN6",70000,932,75.10729614,2,1,1
54347761,"Victoria, Moor Lane, Brierley, Barnsley S72",190000,109,1743.119266,3,2,1
54347618,"""Bamburgh"" at ""Bamburgh"" At School Street, Thurnscoe, Rotherham S63",156995,1900.472222,82.60841604,3,2,1
54347387,"Churchfield Lane, Darton, Barnsley S75",240000,1068.083333,224.7015682,4,0,0
54347040,"Pigeon Bridge Way, Aston, Sheffield S26",170000,651.0714571,261.1080522,3,1,1
54346989,"Byron Road, Maltby, Rotherham S66",86000,808.6458333,106.3506376,4,1,1
41367178,"Derbyshire Lane, Meersbrook, Sheffield S8",247500,1608,153.9179104,2,1,1
54344913,"Meadow Head, Norton, Sheffield S8",300000,1002,299.4011976,3,1,2
54344456,"Lower Dolcliffe Road, Mexborough S64",79950,173,462.1387283,2,1,1
54342228,"Pippin Close, Misterton, Doncaster DN10",139950,797.2569444,175.5393929,3,0,0
54342227,"Hawthorn Croft, Misterton, Doncaster DN10",235000,820.6180556,286.3695216,3,0,0
54341739,"Cheltenham Rise, Doncaster DN5",165000,587.4064744,280.8957803,3,0,0
54341112,"Vivian Road, Firth Park, Sheffield S5",160000,1281,124.90242,4,0,0
54341110,"Rocher Close, Grenoside, Sheffield S35",185000,695.0763889,266.1577964,3,0,0
38003952,"Blenheim Avenue, Barnsley, South Yorkshire S70",70000,598,117.0568562,2,0,0
54339811,"Sandringham Road, Intake, Doncaster DN2",125000,747.8611111,167.1433347,3,0,0
54339317,"Truro Court, Barnsley S71",220000,1375.9,159.8953412,4,1,2
54339308,"Staunton Road, Doncaster, South Yorkshire DN4",165000,817.8125,201.7577379,3,0,0
54338757,"Falcon Close, Adwick-Le-Street, Doncaster DN6",130000,696,186.7816092,3,1,1
54337150,"Park Lane, Womersley, Doncaster, North Yorkshire DN6",610000,4095,148.962149,6,3,2
54335468,"Main Street, Grenoside, Sheffield, South Yorkshire S35",350000,5575.7002,62.77238507,4,2,2
54335429,"Green Close, Renishaw, Sheffield S21",170000,708.5694444,239.9200267,3,1,2
54334801,"Shire Oak Drive, Elsecar, Barnsley S74",375000,1782.411423,210.3891364,6,2,3
54333934,"West Avenue, Royston, Barnsley S71",82500,875.4722222,94.23485738,3,1,2
54333653,"Remple Avenue, Hatfield Woodhouse, Doncaster DN7",215000,792.1689502,271.4067497,3,1,1
54333591,"Bartlett Road, Sheffield, South Yorkshire S5",125000,728,171.7032967,2,1,1
54332664,"Queen Mary Road, Sheffield S2",145000,753,192.563081,3,1,1
54332395,"Ochre Dike Walk, Greasbrough, Rotherham S61",115000,1139,100.9657594,3,1,2
54332252,"Brampton Road, Wath-Upon-Dearne, Rotherham S63",100000,792.5833333,126.1696982,3,1,1
54332238,"Cammidge Way, Bessacarr, Doncaster DN4",150000,647.3125,231.7273342,3,2,2
54332250,"Moss Road, Moss, Doncaster DN6",200000,823.0001237,243.0133292,3,1,2
54331253,"Pickhills Grove, Goldthorpe, Rotherham S63",130000,561.4024869,231.5629215,3,1,1
54331056,"Scarsdale Road, Sheffield S8",139950,591.8,236.4819196,2,1,1
54330780,"Marrion Road, Rawmarsh, Rotherham, South Yorkshire S62",100000,700,142.8571429,3,1,1
54330439,"Tannery Street, Sheffield, South Yorkshire S13",450000,5349.6583,84.11752205,4,1,2
54330431,"Ascot Drive, Laughton Common, Dinnington, Sheffield S25",175000,184,951.0869565,4,0,0
54330348,"Applehaigh View, Royston, Barnsley S71",350000,1400.741803,249.8676053,4,2,1
54330364,"Tenter Balk Lane, Adwick Le Street DN6",175000,667,262.3688156,3,1,2
54329746,"King Street, Hoyland, Barnsley S74",79995,808.8704877,98.89716736,3,1,2
54329483,"The Mount, Edenthorpe, Doncaster. DN3",170000,823.4027778,206.4603188,4,1,2
54329472,"Stoneacre Avenue, Sheffield S12",275000,1041.1,264.1436942,3,2,1
54329335,"Pleasant View, Cudworth, Barnsley S72",60000,522.7222222,114.7837177,2,1,1
54328414,"Rotherham Road, Catcliffe, Rotherham S60",125000,898.678011,139.0931996,3,1,0
54327568,"Carlton Way, Treeton, Rotherham S60",300000,997.3775921,300.7887909,4,1,1
54326076,"White Cross Avenue, Cudworth, Barnsley S72",265000,765,346.4052288,4,3,4
54323996,"Woodhouse Green, Thurcroft, Rotherham, South Yorkshire S66",77500,947,81.8373812,3,0,0
54323780,"341 And 341A Middlewood Road, Hillsborough, Sheffield, South Yorkshire S6",110000,455,241.7582418,0,0,0
54323280,"Lakeside Boulevard, Doncaster DN4",129000,90.8042604,1420.638188,2,1,1
54322745,"Ellenbro Road, Hillsborough, Sheffield S6",160000,1069,149.6725912,3,1,1
54322540,"South View Fold, Ingbirchworth, Penistone, Sheffield S36",245000,679.5416667,360.5371267,2,1,1
54520693,"St Margarets Avenue, Barnburgh, Doncaster DN5",160000,1172,136.5187713,3,1,0
54520739,"West Place, Bentley, Doncaster DN5",105000,943,111.3467656,3,1,0
54322219,"Lord Street, Clifton, Rotherham S65",85000,715.1007672,118.864367,3,1,1
54321451,"Avenue Road, Askern, Doncaster DN6",60000,798.4585673,75.1447883,3,1,1
54320548,"Derwent Chase, Waverley, Rotherham, South Yorkshire S60",230000,1021.439214,225.172479,3,0,0
54320420,"Thornton Street, Kimberworth, Rotherham S61",64950,540.9520399,120.0660968,3,1,1
54320106,"Warren Lane, Chapeltown, Sheffield, South Yorkshire S35",425000,6964.2433,61.02601269,4,3,2
51279543,"Steeton Court, Elsecar, Barnsley S74",125000,651,192.0122888,2,1,1
54319574,"Gurth Avenue Caravan Site, Edenthorpe, Doncaster DN3",50000,268.8680556,185.9648217,2,1,1
54319234,"Shetland Gardens, Intake, Doncaster, South Yorkshire DN2",80000,1011.8066,79.06649354,2,1,2
54318977,"Chapel Street, Mexborough, Mexborough S64",47500,529.1041667,89.7743828,2,1,0
54318906,"Swaledale Road, Sheffield, South Yorkshire S7",315000,1696,185.7311321,5,1,2
54318889,"Brampton Meadows, Thurcroft, Rotherham, South Yorkshire S66",130000,635,204.7244094,2,0,0
54318837,"Hazelwood, Barnsley S71",250000,1569,159.3371574,4,1,2
54318460,"Droppingwell Road, Rotherham, South Yorkshire S61",125000,710,176.056338,3,1,1
54318457,"Dykes Lane, Sheffield, South Yorkshire S6",180000,96,1875,3,1,3
54318380,"Hunstone Avenue, Sheffield S8",249950,1158.7,215.7158885,3,1,2
