url,address,price,size,average,bedroom-number,bathroom-number,reception-number
52840372,"Princess Street, Woodlands, Doncaster DN6",100000,939,106.4962726,3,1,1
52839497,"Solly Street, Sheffield S1",100000,420,238.0952381,1,1,1
52838949,"Warmsworth Road, Balby, Doncaster DN4",180000,2879.86207,62.50299342,4,2,3
52835921,"Ryefield Gardens, Ecclesall, Sheffield S11",180000,670,268.6567164,2,1,1
52835339,"Fairview, Plot 3, Holmes Field Close, Kiveton Park Station, Sheffield S26",420000,955.3819444,439.6147556,3,2,1
52817097,"""The Goodridge"" at ""The Goodridge"" At Doncaster Road, Hatfield, Doncaster DN7",247950,1589.569444,155.9856355,4,0,2
52811486,"Hayfield Lane, Auckley, Doncaster DN9",150000,634.529472,236.395639,3,1,1
52811090,"St. Catherines Way, Barnsley S75",180000,809.6,222.3320158,2,1,2
52810103,"Ryefield Gardens, Ecclesall, Sheffield S11",300000,1020.8,293.8871473,2,2,1
43857265,"Galsworthy Close, Balby, Doncaster DN4",50000,491.8596397,101.6550169,2,1,1
52808342,"Dyke Vale Place, Hackenthorpe, Sheffield S12",120000,567.7083333,211.3761468,3,1,1
52805124,"Hesley Road, Harworth DN11",215000,292,736.3013699,4,1,2
52799953,"Mount Street, Rotherham S61",150000,2116.044962,70.88696256,4,1,2
52799727,"""Radleigh"" at ""Radleigh"" At Bankwood Crescent, New Rossington, Doncaster DN11",276995,2339.013889,118.4238372,4,2,3
52798069,"Nettle Croft, Tickhill, Doncaster DN11",150000,767.625,195.407914,3,0,0
52795590,"The Grange, Woolley Grange, Barnsley, West Yorkshire S75",235000,1310.132488,179.3711721,4,1,2
52790808,"Marton Grove, Hatfield, Doncaster DN7",265000,744,356.1827957,4,1,3
52790029,"Milne Road, Bircotes, Doncaster DN11",85000,619.5987629,137.1855547,3,1,1
52789259,"Furnival Street, Sheffield S1",170000,152,1118.421053,2,1,1
52788625,"Leicester Road, Dinnington, Sheffield S25",45000,662.2500239,67.95016742,3,1,2
52788160,"Myers Grove Lane, Sheffield, Yorkshire S6",595001,2797,212.7282803,3,4,2
52788128,"Hangingwater Close, Sheffield S11",350000,993.4305556,352.3145106,2,1,2
52787927,"Roehampton Rise, Cusworth, Doncaster DN5",230000,1027.118056,223.927521,3,1,2
52787890,"Holme Hall Lane, Stainton, Rotherham S66",360000,1018.423611,353.4874841,4,2,2
52787871,"Fenton Street, Eckington, Sheffield, Derbyshire S21",190000,1198,158.5976628,3,0,0
52787747,"Earl Marshal Road, Sheffield S4",80000,666,120.1201201,2,1,1
52780195,"Highfield Avenue, Goldthorpe, Rotherham S63",265000,768.0891928,345.0120149,4,1,1
52780165,"Pingles Crescent, Thrybergh, Rotherham S65",140000,709.3644897,197.3597523,3,1,1
52777548,"Lindsay Road, Sheffield, South Yorkshire S5",100000,861,116.1440186,3,0,0
52777545,"Parkview, 14 Fitzalan Road, Sheffield, South Yorkshire S13",180000,141,1276.595745,3,0,0
52776688,"Green Oak Crescent, Totley, Sheffield S17",95000,536,177.238806,1,1,1
52776220,"Bawtry Road, Tickhill, Doncaster DN11",839000,2028.090278,413.6896711,5,4,3
52772423,"Marion Road, Hillsborough, Sheffield S6",170000,738.7156931,230.1291303,3,1,2
54395366,"Wooley Edge Lane, Woolley Grange, Barnsley S75",95000,1127.240164,84.276628,2,2,1
52764787,"A G 1, 1 Furnival Street, Sheffield, South Yorkshire S1",115000,457,251.6411379,1,1,1
52757123,"Station Road, Blaxton, Doncaster DN9",325000,2284.416667,142.2682669,4,1,3
52752679,"Station Road, Beckingham, Doncaster DN10",320000,1156.701389,276.6487557,4,2,1
51705801,"'southlands' High Street, Wroot, Doncaster DN9",415000,2144.298611,193.5364775,5,0,0
52750490,"""Windsor"" at ""Windsor"" At School Street, Thurnscoe, Rotherham S63",168995,1482.777778,113.9718996,3,2,2
52749404,"Retford Road, Sheffield S13",150000,892.1184903,168.1390999,3,1,2
52749235,"Fieldhead Road, Hoyland, Barnsley S74",200000,1075.708333,185.9240036,3,0,0
52745384,"Croft Farm Close, Everton, Doncaster DN10",330000,993.3,332.2259136,3,2,0
52742326,"Avon Close, Maltby, Rotherham S66",210000,833.5833333,251.9244227,4,1,2
52742163,"Union Road, Thorne, Doncaster DN8",270000,1967.17,137.2530081,4,2,2
52740194,"Parkin Court, Ravenfield, Rotherham S65",220000,1060.854167,207.3800593,4,3,2
52739566,"Sandwith Road, Todwick, Sheffield S26",270000,769.6944444,350.7885525,3,1,1
52739194,"Haxey Grange, Haxey, Doncaster DN9",470000,2419,194.2951633,4,2,4
49604015,"Hampole Balk Lane, Skellow, Doncaster DN6",170000,886.4674428,191.7724124,3,1,1
52730043,"Bawtry Road, Harworth, Doncaster DN11",100000,678.2218286,147.4443844,3,1,1
52729343,"Central Boulevard, Wheatley Hills, Doncaster DN2",180000,786.9478274,228.7318088,3,1,2
52728001,"Kirkstone Road, Sheffield, South Yorkshire S6",155000,95,1631.578947,4,0,0
52727112,"Bramble Way, Auckley, Doncaster DN9",190000,184,1032.608696,3,1,2
52727087,"Ashwell Grove, Rotherham S65",110000,506.4930556,217.1796805,2,1,1
52727074,"Southwood Drive, Thorne, Doncaster DN8",140000,585.5486111,239.0920196,3,1,1
52724006,"Aysgarth Road, Sheffield S6",225000,958,234.8643006,3,3,1
52723099,"Upper Hoyland Road, Hoyland, Barnsley S74",150000,1014.652778,147.8338238,3,0,0
52719858,"Windmill Hill Lane, Chapeltown, Sheffield, South Yorkshire S35",460000,4512,101.9503546,5,1,2
52718279,"Farm View Road, Kimberworth, Rotherham S61",580000,2582.076624,224.6254022,5,3,1
52716002,"Longfield Road, Crookes, Sheffield S10",160000,667,239.88006,2,0,0
52712437,"High Street, Bawtry, Doncaster DN10",149950,486.0726071,308.4930066,2,1,1
52711148,"Pinfold Lane, Moss, Doncaster, South Yorkshire DN6",399950,2764.031742,144.6980488,4,2,2
52709602,"Low Grange Road, Thurnscoe, Rotherham S63",70000,543.7361111,128.7389205,3,1,1
52708869,"Askern Road, Bentley, Doncaster DN5",80000,626.2777778,127.738845,2,1,2
52708854,"Oxford Street, East Dene, Rotherham S65",90000,824.2777778,109.1864932,2,1,2
52707140,"Sour Lane, Fishlake, Doncaster DN7",375000,1658.766239,226.0716376,4,2,3
52705422,"Worksop Road, Swallownest, Sheffield S26",400000,1482.3,269.8509074,3,2,2
52698336,"Backfield Lane, Hatfield, Doncaster DN7",310000,1206.638889,256.9119915,4,2,1
52697565,"Bruce Crescent, Intake, Doncaster. DN2",140000,722.0902778,193.8815745,3,1,1
52696765,"Haigh Moor Way, Royston, Barnsley S71",210000,1120.893588,187.350523,4,1,1
52693301,"Huxterwell Drive, Balby, Doncaster, South Yorkshire DN4",135000,751.75,179.5809777,3,1,0
52686060,"St. Anns Road, Rotherham, South Yorkshire S65",65000,980,66.32653061,2,0,0
52684739,"North End Drive, Harlington, Doncaster DN5",155000,741,209.1767881,3,1,1
52682517,"Clumber Street, Barnsley S75",115000,760.3,151.2560831,2,1,2
52681094,"Redmires Road, Sheffield S10",290000,804.1277726,360.6392042,3,1,1
52678847,"John Hibbard Close, Woodhouse, Sheffield S13",250000,951.6180556,262.710442,4,2,1
52671399,"Westwood Road, Bawtry, Doncaster DN10",485000,1103.520833,439.5023504,4,3,2
52670053,"Askern Road, Bentley, Doncaster DN5",70000,795.6458333,87.97884318,3,0,0
52667876,"Oak Lea Avenue, Rotherham S63",115000,773,148.771022,3,1,1
52032087,"St. James Avenue, South Anston, Sheffield S25",135000,1033.3344,130.6450264,3,1,1
52666715,"Earlesmere Avenue, Balby, Doncaster, South Yorkshire DN4",170000,1006.3,168.9357051,5,5,0
52664525,"Scholes Lane, Scholes, Rotherham S61",475000,2442.916667,194.4397066,3,0,0
52663500,"Sorby Row, Waverley, Rotherham S60",265000,1205.144543,219.890636,4,3,1
52661270,"Windsor Crescent, Barnsley S71",120000,737,162.8222524,2,1,1
52659346,"Highstone Crescent, Barnsley S70",125000,931.0555556,134.2562205,4,1,1
52656213,"Thorpe Street, Thorpe Hesley, Rotherham, South Yorkshire S61",350000,1722,203.2520325,3,2,2
52649974,"Green Rise, Rawmarsh, Rotherham S62",184700,1087.1539,169.8931494,3,1,3
52686280,"Market Place, Bawtry, Doncaster, South Yorkshire DN10",100000,431.9294736,231.5192783,2,1,1
52644958,"""Maidstone"" at Poplar Way, Catcliffe, Rotherham S60",224995,695.9166667,323.3073883,3,2,2
52644957,"""Maidstone"" at Poplar Way, Catcliffe, Rotherham S60",229995,695.9166667,330.4921566,3,2,2
54247717,"Grange Lane, Maltby, Rotherham S66",119950,809.8854219,148.1073702,4,1,0
52639455,"Gleadless View, Gleadless, Sheffield S12",194000,1186,163.5750422,4,3,2
52639449,"Kew Crescent, Charnock, Sheffield S12",134950,596,226.4261745,1,1,1
52632098,"Pickard Crescent, Sheffield, South Yorkshire S13",500000,2325,215.0537634,5,2,3
52631609,"Clanricarde Street, Barnsley S71",75000,564.0972222,132.9558045,2,1,2
52628561,"Alston Close, Silkstone, Barnsley S75",310000,1453.1875,213.3241581,4,0,0
54295510,"Grasmere Close, Mexborough S64",115000,646.8055556,177.7968649,3,1,1
52679596,"Tunwell Greave, Sheffield S5",185000,604.6319436,305.9712639,2,1,2
52622930,"Springfield Avenue, Hatfield, Doncaster DN7",110000,477.0208333,230.5978949,3,1,1
52620341,"Wareham Grove, Dodworth, Barnsley S75",215000,969.8251902,221.6894366,2,1,2
52620339,"Silkstone Oval, Moorends, Doncaster DN8",95000,618.2774762,153.6526942,3,1,1
52611663,"Keresforth Hill Road, Barnsley S70",315000,1537.9,204.824761,3,1,0
52609555,"Broadcroft Close, Beighton, Sheffield S20",220000,856.74,256.7873567,3,2,1
52607468,"Lemont House, Lemont Road, Totley S17",185000,478.1736111,386.8887695,2,1,1
52605084,"Suffolk Road, Bircotes, Doncaster DN11",75000,737.0308755,101.7596447,3,1,1
52604566,"Mayfield Heights, Fulwood, Sheffield S10",425000,1282,331.5132605,3,2,1
52603259,"Stradbroke Road, Woodhouse, Sheffield S13",170000,1020.705116,166.5515312,3,1,1
49001092,"Edna Street, Bolton On Dearne, Rotherham S63",67000,737,90.90909091,2,1,2
52596899,"Alpina Way, Swallownest, Sheffield S26",110000,775,141.9354839,2,2,1
52595087,"""Tavistock"" at ""Tavistock"" At Dearne Hall Road, Barugh Green, Barnsley S75",262995,2273.25,115.691191,4,2,2
52595059,"Hesley Lane, Thorpe Hesley, Rotherham S61",150000,561.9630591,266.9214596,2,1,1
52585510,"Huddersfield Road, Barnsley S75",325000,1668.940537,194.7343196,7,0,0
52584396,"Mulberry Court, Warmsworth, Doncaster DN4",160000,830.3939822,192.6796237,3,2,2
52583868,"Beacon Road, Sheffield S9",95000,609,155.9934319,2,1,1
52573504,"Sycamore Drive, Auckley, Doncaster DN9",159950,733.3402778,218.1115709,3,1,2
52573362,"Broomfield Grove, Broom, Rotherham S60",135000,880.9463096,153.2442994,3,1,3
47221780,"Chesterfield Road Woodseats, Sheffield S8",90000,365,246.5753425,1,1,1
52567931,"Church Street, Rawmarsh, Rotherham S62",185000,1090.232047,169.6886461,5,2,2
52566105,"Woodfoot Road, Moorgate, Rotherham S60",435000,1386.710911,313.6919141,3,1,1
52565904,"Greystones Drive, Sheffield S11",299950,1042.8,287.6390487,3,2,2
52565035,"East Street, Darfield, Barnsley S73",100000,583.9006722,171.2620053,3,1,1
52564976,"Bartle Road, Sheffield S12",325000,1690.862033,192.2096502,6,4,4
52562996,"Church Road, Stainforth, Doncaster DN7",80000,672.7414656,118.9164101,3,1,1
52561933,"Court Close, Scawsby, Doncaster. DN5",157500,808.0138889,194.922392,3,1,2
52561485,"Longman Road, Barnsley S70",130000,1153.346471,112.7154791,4,1,1
52558726,"Helmsley Close, Sheffield S26",200000,1002,199.6007984,3,1,2
54520930,"Bentley Road, Doncaster DN5",89999,404,222.769802,1,1,0
52549372,"Chiltern Road, Scawthorpe, Doncaster, South Yourshire DN5",90000,773.58,116.3422012,3,1,1
52545137,"The Rise, Brierley, Barnsley S72",145000,830.9097222,174.5075261,4,0,0
52545131,"Underhill Farm, Underhill Lane, Sheffield S6",660000,1261.930556,523.0081775,3,0,0
45429571,"Warren Lane, Staincross Barnsley S75",387950,1304,297.5076687,4,1,2
52538965,"Mill Road, Ecclesfield, Sheffield, South Yorkshire S35",320000,1111,288.0288029,3,1,2
52531193,"Briton Street, Thurnscoe, Rotherham S63",80000,760.5975747,105.1804563,3,1,1
52527379,"Pemberton Grove, Bawtry, Doncaster DN10",149000,467.6168433,318.6369399,2,1,1
52527221,"Stannington Road, Stannington, Sheffield S6",160000,1128.444444,141.7881056,2,2,1
52524080,"Wyatt Avenue, Sheffield S11",299950,1005.6,298.279634,3,1,2
52520206,"Low Lane, Braithwaite, Doncaster DN7",179000,378,473.5449735,4,2,2
52512275,"Thicket Drive, Maltby, Rotherham S66",98000,429.625,228.1059063,2,1,1
54247828,"Leopold Avenue, Dinnington, Sheffield S25",72500,677.9583333,106.9387253,2,1,2
52498741,"Skelton Lane, Woodhouse, Sheffield S13",74500,388.7083333,191.6604138,1,1,1
52492948,"Harvest Avenue, Thurcroft, Rotherham, South Yorkshire S66",160000,940,170.212766,3,0,0
52489077,"Newbould Lane, Sheffield S10",550000,680,808.8235294,5,3,3
52336418,"Owston, Doncaster DN6",395000,1166.817524,338.5276548,3,2,2
52479196,"Ecclesall Rd - Shire House, Wards Brewery, Sheffield S11",165000,544.4488259,303.0587856,2,2,1
52478378,"John Ward Street, Woodhouse, Sheffield S13",115000,873.9,131.5940039,3,1,1
52474811,"Midland Road, Royston, Barnsley, South Yorkshire S71",110000,1098.063113,100.1763913,4,1,3
52474169,"Reney Avenue, Sheffield S8",120000,556.8,215.5172414,2,1,1
52473968,"Sylvester Street, Sheffield S1",128000,548,233.5766423,1,1,1
52461913,"Davis Street, Rotherham S65",200000,333,600.6006006,4,4,0
52472576,"Churchfield Road, Campsall, Doncaster, South Yorkshire DN6",100000,843.71,118.5241374,3,1,2
52470071,"Church Street, Mexborough S64",169950,968.9791667,175.3907678,4,1,2
52464374,"Redhaw Road, Royston, Barnsley S71",240000,2906.253,82.58055992,4,1,1
52459327,"45A Mowbray Street, Kelham Island, Sheffield S3",125000,354,353.1073446,1,1,1
52457135,"Leslie Road, Barnsley S70",110000,689,159.6516691,3,1,1
52456006,"Calder Close, Royston, Barnsley S71",180000,1011,178.041543,3,1,2
52453850,"Drewry Lane, Westwoodside, Doncaster DN9",320000,1603.815574,199.5241879,4,3,2
52452027,"Halmshaw Terrace, Bentley, Doncaster, South Yorkshire DN5",150000,902.81,166.147916,3,1,2
52448696,"Arlott Way, Edlington, Doncaster DN12",199950,1101.034722,181.6019023,4,1,1
52440275,"Boundary Green, Rawmarsh, Rotherham S62",150000,653.0318117,229.6978452,3,1,1
52440118,"Riviera Parade, Bentley, Doncaster DN5",45000,498.75,90.22556391,2,1,1
52439958,"Fitzhubert Road, Sheffield S2",90000,487.490249,184.6190774,2,1,1
52438702,"Rectory Close, Skelbrooke, Doncaster, South Yorkshire DN6",500000,3577.38,139.7670921,5,4,5
52430834,"Canberra Avenue, Lindholme, Doncaster DN7",180000,1012.555556,177.7680237,3,0,0
52430329,"Main Street, Rawmarsh, Rotherham S62",83500,557.0833333,149.8878085,2,1,2
52429341,"The Grove, Wheatley Hills, Doncaster. DN2",215000,810.2152778,265.3615723,3,1,1
52429124,"Rushy Moor Avenue, Askern, Doncaster DN6",118000,94.9,1243.41412,3,1,1
50888876,"South View, High Street, Norton, Doncaster DN6",270000,1513.083333,178.4435755,5,3,2
52428351,"Wentworth Road, Barnsley, South Yorkshire S74",349950,2731.898271,128.097742,5,4,2
52427428,"Steventon Road, Thrybergh, Rotherham, South Yorkshire S65",120000,495,242.4242424,2,1,1
52420093,"Queen Street, Epworth, Doncaster DN9",575000,2157.25,266.5430525,4,2,2
52418724,"Cresacre Avenue, Barnburgh, Doncaster. DN5",135000,774.8333333,174.2310174,3,1,1
52417790,"Cypress Road, Kendray, Barnsley S70",95000,726.5208333,130.760187,3,1,2
52416677,"Main Street, Wadworth, Doncaster DN11",265000,1008.347222,262.8062974,3,1,0
52415872,"Bawtry Road, Bramley, Rotherham S66",280000,1386.191722,201.992261,3,1,1
52410769,"Brooke Close, Deepcar, Sheffield S36",250000,238,1050.420168,4,1,2
52686277,"Shuttle Close, Rossington, Doncaster, South Yorkshire DN11",150000,2787.8501,53.80490149,3,3,1
52404264,"Millard Avenue, Hatfield, Doncaster DN7",210000,1188.094589,176.7536036,4,2,1
52404254,"Broadway, Dunscroft, Doncaster DN7",100000,631.6775721,158.3086125,3,1,1
52399580,"Hill Street, Elsecar, Barnsley, South Yorkshire S74",190000,582.0277778,326.4449005,3,0,0
52394227,"Warmsworth Road, Balby, Doncaster DN4",220000,1340.864156,164.0732948,4,2,1
52390913,"Rye Croft, Tickhill, Doncaster DN11",325000,821.5347222,395.6010516,4,2,3
52388377,"Logan Road, Sheffield, South Yorkshire S9",85000,1429,59.48215535,3,1,1
49271214,"Dayhouse Court, Redbrook, Barnsley, South Yorkshire S75",80000,440.6666667,181.5431165,2,0,0
54247782,"Bawtry Road, Wickersley, Rotherham S66",340000,1038.326389,327.4500231,3,1,3
52374433,"The Avenue, Bessacarr, Doncaster DN4",260000,807.625,321.9315895,2,1,1
52374134,"Laycock Avenue, Gringley-On-The-Hill, Doncaster DN10",122500,648.7,188.8392169,2,1,1
52370544,"Howden Avenue, Skellow, Doncaster DN6",170000,848.7485845,200.2948849,3,1,2
52368299,"Green Lane, Scawthorpe, Doncaster DN5",480000,2240.555556,214.2325812,4,3,1
52679943,"High Street, Epworth, Doncaster, South Yorkshire DN9",290000,4669.046139,62.11118746,3,1,2
52367728,"Scotsman Drive, Scawthorpe, Doncaster DN5",43500,721.8611111,60.26089968,3,1,1
52367324,"Beaver Hill Road, Woodhouse, Sheffield S13",135000,764,176.7015707,3,1,1
52365103,"Hemingfield Road, Hemingfield, Barnsley S73",95000,635.1666667,149.5670428,3,0,0
52361362,"Palmerston Avenue, Maltby, Rotherham S66",180000,868.4097222,207.2754316,2,1,2
52357315,"Mansfield Road, Sheffield S12",109500,873,125.4295533,3,1,2
45975866,"Fox Holes Grove, Crow Edge, Sheffield S36",389950,2428.923611,160.5443655,4,3,4
52348702,"Shortbrook Close, Westfield, Sheffield S20",90000,905,99.44751381,3,1,1
52348016,"Sheffield Road, Penistone, Sheffield S36",300000,2150.5,139.5024413,4,3,4
52679605,"Bellhouse Road, Sheffield S5",75000,503.021804,149.0989047,2,1,1
52679868,"Shadyside, Hexthorpe, Doncaster, South Yorkshire DN4",54000,527,102.4667932,2,1,0
52336582,"Madison Drive, Bawtry, Doncaster DN10",400000,903.3125,442.8146406,4,3,2
52333929,"Raby Street, Tinsley, Sheffield S9",75000,872,86.00917431,2,1,2
52333913,"Coniston Road, Askern, Doncaster DN6",145000,743,195.1547779,3,1,1
52330728,"Kingsmead Drive, Branton, Doncaster DN3",234950,986.0347222,238.2776131,3,1,1
52323311,"Frobisher Grove, Maltby, Rotherham S66",105000,301.5755473,348.1714646,1,1,2
52322541,"Church Lane, Aston, Sheffield S26",475000,1609.710428,295.0841293,4,1,2
52321102,"Brampton Lane, Armthorpe, Doncaster DN3",190000,823.3333333,230.7692308,3,1,2
52025973,"Conway Crescent, East Herringthorpe, Rotherham S65",47500,660.0416667,71.96515372,2,1,1
52679930,"St. Martins Avenue, Scawsby, Doncaster, South Yorkshire DN5",129950,567.7279124,228.8948582,3,1,1
52305964,"High Street, Beighton, Sheffield, South Yorkshire S20",80000,738,108.401084,2,0,0
52305973,"Normanville Avenue, Brinsworth, Rotherham S60",125000,789,158.4283904,2,0,0
52304669,"Beckfield Rise, Auckley, Doncaster. DN9",330000,1151.409722,286.6051881,4,2,3
47200990,"Alexandra Road, Swallownest, Sheffield S26",150000,780.3217623,192.2283951,3,1,2
52302669,"Meadstead View, Church Street, Royston, Barnsley, South Yorkshire. S71",275000,3300.6,83.31818457,4,2,3
52294166,"Manor Avenue, Goldthorpe, Rotherham S63",65000,534.9375,121.5095221,2,1,1
46552188,"The Crescent, Dunscroft, Doncaster DN7",57000,591.388041,96.38341672,3,1,2
52289259,"Harwood Gardens, Waterthorpe, Sheffield, South Yorkshire S20",230000,844,272.5118483,3,0,0
49033993,"Highcliffe Court, Swinton, Mexborough S64",200000,1302,153.609831,4,1,2
52286362,"The Steelhouse, 11 Castle Street, Sheffield, South Yorkshire S3",100000,439,227.7904328,1,1,1
52285586,"Michaels Estate, Grimethorpe, Barnsley S72",85000,646,131.5789474,2,1,1
52282901,"Scot Lane, Doncaster, South Yorkshire DN1",370000,2776.9,133.2421045,6,3,0
52282129,"Pontefract Road, Barnsley S71",110000,793.812868,138.5717018,4,2,3
52280803,"Broxholme Lane, Doncaster, South Yorkshire DN1",175000,1384.6,126.3902932,5,3,0
52280282,"Edlington, Doncaster DN12",150000,98,1530.612245,4,1,1
52266402,"Pine Avenue, South Anston, Sheffield S25",245000,649.929664,376.9638679,3,1,1
52679869,"Urban Road, Hexthorpe, Doncaster, South Yorkshire DN4",80000,840,95.23809524,3,1,1
52262332,"Cockshutt Road, Sheffield S8",275000,897.3,306.4749805,2,1,0
52261300,"Lower Collier Fold, Cawthorne, Barnsley S75",334950,1045.9,320.250502,4,2,1
52259842,"Hollinsend Road, Sheffield, South Yorkshire S12",90000,657,136.9863014,2,1,1
52259294,"Green Shank Drive, Mexborough S64",270000,1321.597222,204.2982502,4,1,2
52256057,"Buckleigh Road, Wath-Upon-Dearne, Rotherham S63",235000,1101.749748,213.2970762,3,1,2
52252109,"Sycamore Crescent, Bawtry, Doncaster DN10",633750,1664.857242,380.663269,4,2,2
52249385,"St. Andrews Road, Sheffield S11",199950,733,272.7830832,2,2,1
52246392,"Blyth Avenue, Rawmarsh, Rotherham S62",75000,601.6383993,124.6595963,3,1,1
52244946,"Parkway, Armthorpe, Doncaster DN3",220000,814.8604346,269.9848841,4,2,1
52243959,"Greenhall Road, Eckington, Sheffield S21",165000,721.8,228.5951787,3,1,1
52243060,"Highgate Lane, Goldthorpe, Rotherham S63",265000,591.5486111,447.976709,3,0,0
52237951,"Flat Lane, Billingley, Barnsley S72",240000,954.0495279,251.5592671,3,1,1
52231841,"Pickhills Grove, Rotherham S63",117000,904,129.4247788,3,1,1
51055598,"Gunthwaite, Penistone, Sheffield S36",850000,1857.572508,457.5864449,4,3,3
52228105,"Thorpe Drive, Waterthorpe, Sheffield S20",170000,777.4,218.6776434,3,1,1
52227427,"""Ripon"" at ""Ripon"" At Bankwood Crescent, New Rossington, Doncaster DN11",236995,1961.125,120.8464529,4,2,2
52227428,"""Alderney"" at ""Alderney"" At Bankwood Crescent, New Rossington, Doncaster DN11",249995,2130.430556,117.3448247,4,2,3
52227424,"""Windermere"" at Wheatley Hall Road, Doncaster DN2",229995,937.5,245.328,4,2,2
52227425,"""Alderney"" at Wheatley Hall Road, Doncaster DN2",265995,1065.215278,249.7100873,4,2,3
52221910,"Shaftsbury Avenue, Woodlands, Doncaster DN6",100000,792.1110954,126.2449176,3,1,2
54405930,"Piccadilly Road, Swinton, Mexborough S64",147000,857.5,171.4285714,3,1,2
52220997,"Stonegarth Close, Cudworth, Barnsley S72",158000,818.6176903,193.0082893,3,1,1
52219076,"Plots 1 And 2 Darley House, Darley Grove, Worsbrough Dale, Barnsley, South Yorkshire S70",420000,3510.576389,119.6384734,10,2,0
52211016,"Apartment 1/Linden House Linden Avenue, Sheffield S8",325000,2107.57162,154.2059102,3,2,2
52208203,"Ischia, Low Lane, Braithwaite, Doncaster DN7",399950,2193,182.375741,4,2,1
52206643,"Shepherd Lane, Thurnscoe S63",92500,980.3,94.35886973,3,1,0
52205778,"Fields End, Oxspring, Sheffield S36",450000,2455.4,183.2695284,4,3,5
52204602,"Fish Dam Lane, Carlton, Barnsley S71",97500,1117.7,87.23271003,3,1,3
52679580,"Old Mill Lane, Barnsley, South Yorkshire S70",115000,926,124.1900648,3,1,2
52198752,"Staniforth Crescent, Todwick, Sheffield S26",270000,790.583698,341.5198172,3,1,1
52198616,"Bradgate Road, Rotherham S61",145000,95,1526.315789,3,1,2
54405871,"Harlington Road, Mexborough S64",109950,786.9513889,139.7163809,2,1,1
52195476,"Blacker Grange Farm, Off Grange View, Blacker Hill, Barnsley S74",400000,1249.708333,320.0746841,4,2,2
51221887,"Ladywood Road, Barnsley S72",110000,1071,102.7077498,3,1,2
52188762,"Manor Grove, Brodsworth, Doncaster DN5",595000,3681.916667,161.6006156,6,0,0
52184028,"High Street, Goldthorpe, Rotherham S63",50000,599.4930556,83.40380182,2,1,1
52183722,"Auckland Rise, Halfway, Sheffield S20",220000,674.5972222,326.1205246,2,1,1
52183615,"Redshank Road, Wath-Upon-Dearne, Rotherham S63",135000,673.6317718,200.4062244,2,1,2
52182984,"Moorhouse Drive, Thurcroft, Rotherham S66",260000,946.1527778,274.7970583,4,2,2
52180678,"Heelis Street, Barnsley S70",60000,445.7291667,134.6108904,2,1,1
54247729,"Bevan Crescent, Maltby, Rotherham S66",275000,680.3472222,404.205369,2,1,2
52172674,"Meadstead View, Church Street, Royston, Barnsley, South Yorkshire. S71",375000,3300.6,113.6157062,4,2,3
52172674,"Meadstead View, Church Street, Royston, Barnsley, South Yorkshire. S71",375000,3300.6,113.6157062,4,2,3
52171594,"Epping Gardens, Sothall, Sheffield S20",130000,490.618562,264.9716298,2,1,1
52165693,"Autumn Drive, Maltby, Rotherham S66",210000,476.2291667,440.9641717,4,1,1
52160490,"Acer Close, South Anston, Sheffield S25",268000,1022.5705,262.0846191,3,1,2
52160257,"""Ripon"" at Wheatley Hall Road, Doncaster DN2",234995,980.5625,239.6532602,4,2,2
52160256,"""Moresby"" at Wheatley Hall Road, Doncaster DN2",189995,1335.291667,142.2872656,3,2,2
52160255,"""Derwent"" at Wheatley Hall Road, Doncaster DN2",220995,1698.208333,130.1342101,3,2,2
52159987,"Eastfield Road, Epworth, Doncaster DN9",184950,746.7430556,247.675554,3,1,2
52159305,"Birchdale Close, Edenthorpe, Doncaster DN3",200000,1042.652778,191.8184119,3,1,1
52156377,"High Greave, Barnsley S71",190000,1235.541667,153.778707,4,0,0
52156376,"Milgate Street, Royston, Barnsley S71",40000,555.1805556,72.04863283,2,0,0
52156183,"Ormond Road, Jordanthorpe, Sheffield S8",110000,865,127.1676301,3,1,1
52151652,"King Ecgbert Road, Totley Rise, Sheffield S17",350000,1407.3,248.7031905,4,3,2
52142959,"Bradlea Rise, Rawmarsh, Rotherham S62",135000,705.1736111,191.4422177,3,1,1
52141679,"Moor Lane North, Ravenfield, Rotherham, South Yorkshire S65",330000,3735.0733,88.35167974,4,2,3
52140734,"Bawtry Road, Harworth, Doncaster DN11",120000,728.3716554,164.7510568,3,1,1
52140541,"Morley Road, Doncaster DN1",175000,1930,90.67357513,3,3,3
52140225,"Great North Road, Bawtry, Doncaster DN10",650000,2517.75,258.1670142,5,2,3
52127376,"Oxclose Park Way, Halfway, Sheffield S20",280000,1136.78,246.3097521,4,2,1
52126873,"Providence Street, Greasbrough, Rotherham S61",175000,907.1919395,192.9029485,3,1,1
52125978,"The Bungalows, Sheffield Road, Killamarsh, Sheffield S21",205000,1053.6,194.5709947,4,2,1
52120753,"Church Street, Swinton, Mexborough S64",159950,702.9861111,227.5293885,3,1,2
52120601,"King Edward Street, Belton, Doncaster DN9",475000,2732.569444,173.8290681,4,2,3
52120266,"Peakes Croft, Bawtry, Doncaster DN10",85000,437.0625,194.4801945,2,0,0
52113490,"Rectory Lane, Thurnscoe, Rotherham S63",175000,722.3060666,242.2795655,3,1,1
52102183,"Saffron Road, Tickhill, Doncaster DN11",280000,707.9861111,395.4879843,4,2,2
51982434,"Solly Street, Sheffield S1",140000,692.1805556,202.2593655,2,2,1
52093054,"Midland Road, Royston, Barnsley S71",80000,661.9097222,120.8624036,2,2,2
52079429,"Lakeside Boulevarde, Lakeside, Doncaster DN4",120000,647,185.4714065,2,1,1
52076276,"Fitzalan Way, Treeton, Rotherham, South Yorkshire S60",155000,700,221.4285714,3,1,1
52076270,"Friends Close, Thurcroft, Rotherham, South Yorkshire S66",225000,1399.307,160.7938787,4,2,2
52076101,"Spout House Lane, Bromley, Sheffield S35",495000,2027,244.203256,3,1,2
